<!--
# Copyright (C) 2006 Olivier COUPELON

# This file is part of Teardrop.
#
# Teardrop is free software; you can redistribute it and/or modify
# it under the terms of the GNU General Public License as published by
# the Free Software Foundation; either version 2 of the License, or
# (at your option) any later version.
#
# Teardrop is distributed in the hope that it will be useful,
# but WITHOUT ANY WARRANTY; without even the implied warranty of
# MERCHANTABILITY or FITNESS FOR A PARTICULAR PURPOSE.  See the
# GNU General Public License for more details.
#
# You should have received a copy of the GNU General Public License
# along with Teardrop; if not, write to the Free Software
# Foundation, Inc., 51 Franklin St, Fifth Floor, Boston, MA  02110-1301  USA
-->
<engine xmlns:xsi="http://www.w3.org/2001/XMLSchema-instance"
        xsi:noNamespaceSchemaLocation="teardrop_1_0.xsd">
	<name>Ask France</name>
  <separator value="+" />
	<charset>UTF-8</charset>
	<terms>http://sp.fr.ask.com/fr/docs/legal/terms.shtml</terms>
	<query method="GET">
    <url>http://fr.ask.com/web</url>
    <inputfield name="q" value="%q" />
  </query>
  <result>
    <regexp>class="L4"\s+href="([^"]*)"[^&gt;]*&gt;(.*?)&lt;/a&gt;.*?&lt;/div&gt;\s*(.*?)\s*&lt;div\s+id="[^"]*"\s+class="prel\s+T11"</regexp>
    <field num="1" comparable="yes" name="url" />
    <field num="2" striphtml="yes" name="title" />
    <field num="3" striphtml="yes" name="abstract" />
  </result>
	<nextinput method="GET">
		<regexp>&lt;a\s+href="([^"]*)"\s+onMouseDown="[^"]*"\s+class="L14"&gt;Suivante</regexp>
		<inputfield escape="no" num="1" name="" value="%s" />
	</nextinput>
</engine>
