<!--
Copyright 2008 Olivier COUPELON
Licensed under the Apache License, Version 2.0 (the "License"); you may not use this file except in compliance with the License.
You may obtain a copy of the License at http://www.apache.org/licenses/LICENSE-2.0
Unless required by applicable law or agreed to in writing, software distributed under the License is distributed on an "AS IS" BASIS, WITHOUT WARRANTIES OR CONDITIONS OF ANY KIND, either express or implied.
See the License for the specific language governing permissions and limitations under the License.
 -->
<engine xmlns:xsi="http://www.w3.org/2001/XMLSchema-instance"
        xsi:noNamespaceSchemaLocation="teardrop_1_0.xsd">
	<name>Ebooks Portal v3.0</name>
  <separator value="%20" />
	<charset>UTF-8</charset>
	<query method="GET">
		<url>http://www.ebooksportal.org/</url>
		<inputfield name="s" value="%q" />
  </query>
  <result>
		<regexp><![CDATA[<h3[^>]*><a\s+href="([^"]*)"[^>]*>(.*?)</a></h3>.*?<small>([^>]*)</small>]]></regexp>
		<field num="1" comparable="yes" name="url" />
		<field num="2" striphtml="yes" name="title" />
		<field num="3" striphtml="yes" name="abstract" />
  </result>
  <nextinput method="GET">
    <regexp><![CDATA[Search\s+Results.*?href=".*?paged=([0-9]*)">Â« Previous Entries]]></regexp>
    <url>http://www.ebooksportal.org/</url>
    <inputfield escape="no" name="s" value="%q" />
    <inputfield escape="no" num="1" name="paged" value="%s" />
  </nextinput>
</engine>
