<!--
Copyright 2008 Olivier COUPELON
Licensed under the Apache License, Version 2.0 (the "License"); you may not use this file except in compliance with the License.
You may obtain a copy of the License at http://www.apache.org/licenses/LICENSE-2.0
Unless required by applicable law or agreed to in writing, software distributed under the License is distributed on an "AS IS" BASIS, WITHOUT WARRANTIES OR CONDITIONS OF ANY KIND, either express or implied.
See the License for the specific language governing permissions and limitations under the License.
 -->
<engine xmlns:xsi="http://www.w3.org/2001/XMLSchema-instance"
        xsi:noNamespaceSchemaLocation="teardrop_1_0.xsd">
	<name>arXiv.org</name>
  <separator value=" " />
	<charset>UTF-8</charset>
  <header>User-Agent: Mozilla/5.0</header>
	<query method="POST">
    <url>http://arxiv.org/search</url>
    <inputfield name="query" value="%q" />
    <inputfield name="searchtype" value="all" />
  </query>
  <result>
    <regexp><![CDATA[\+1">.*?href="([^"]*)">abs.*?Title:\s*(.*?)<br\s*/>(.*?)&nbsp;<br\s*/>]]></regexp>
    <field num="1" comparable="yes" name="url">http://arxiv.org%s</field>
    <field num="2" striphtml="yes" name="title" />
    <field num="3" striphtml="yes" name="abstract" />
  </result>
	<nextinput method="GET">
		<regexp><![CDATA[<a\s+href="([^"]*)">Next 25 results</a>]]></regexp>
		<inputfield escape="no" num="1" name="" value="http://arxiv.org%s" />
	</nextinput>
</engine>
